<?xml version="1.0" encoding="UTF-8"?>

<TimeTable xmlns:xsi="http://www.w3.org/2001/XMLSchema-instance" xsi:noNamespaceSchemaLocation="file:/C:/ITMO/ITMO.HTML&amp;XMLCourses2023/XML%20Labs/Lab3/Ex1_lesson_XML.xsd">
	<subject>
		<SubjectName>Основы программирования</SubjectName>
		<TeacherName>Денис</TeacherName>
		<TeacherLastName>Ямщиков</TeacherLastName>
		<TeacherPatronymicName>Викторович</TeacherPatronymicName>
		<Hours>45</Hours>
		<StartDate>27.03.2023</StartDate>
		<FinalDate>11.04.2023</FinalDate>
		<FinalGrade>Зачет</FinalGrade>		
	</subject>
	
	<subject>
		<SubjectName>Программирование на C#</SubjectName>
		<TeacherName>Никита</TeacherName>
		<TeacherLastName>Осипов</TeacherLastName>
		<TeacherPatronymicName>Алексеевич</TeacherPatronymicName>
		<Hours>50</Hours>
		<StartDate>13.04.2023</StartDate>
		<FinalDate>28.04.2023</FinalDate>
		<FinalGrade>Зачет</FinalGrade>		
	</subject>
	
	<subject>
		<SubjectName>Введение в базы данных</SubjectName>
		<TeacherName>Ирина</TeacherName>
		<TeacherLastName>Осетрова</TeacherLastName>
		<TeacherPatronymicName>Станиславовна</TeacherPatronymicName>
		<Hours>35</Hours>
		<StartDate>01.06.2023</StartDate>
		<FinalDate>16.06.2023</FinalDate>
		<FinalGrade>Зачет</FinalGrade>		
	</subject>
</TimeTable>
